{
  "schema_version": "xyn.appspec.v0",
  "app_slug": "minimal-app",
  "title": "Minimal App",
  "workspace_id": "11111111-1111-1111-1111-111111111111",
  "services": [
    {
      "name": "minimal-api",
      "image": "xyn-api:latest",
      "env": {},
      "ports": [{"container": 8080, "host": 0, "protocol": "tcp"}],
      "depends_on": []
    }
  ],
  "data": {"postgres": {}},
  "reports": []
}
