{
  "schema_version": "xyn.appspec.v0",
  "app_slug": "mixed-relationship-aliases",
  "title": "Mixed Relationship Aliases",
  "workspace_id": "a1111111-1111-1111-1111-111111111111",
  "services": [
    {
      "name": "mixed-rel-api",
      "image": "xyn-api:latest",
      "env": {},
      "ports": [{"container": 8080, "host": 0, "protocol": "tcp"}],
      "depends_on": []
    }
  ],
  "data": {"postgres": {}},
  "reports": [],
  "entity_contracts": [
    {
      "key": "votes",
      "fields": [
        {"name": "id", "type": "uuid"},
        {
          "name": "poll_id",
          "type": "uuid",
          "relation": {
            "kind": "belongs_to",
            "related_entity": "polls",
            "target_field": "id"
          }
        },
        {
          "name": "option_id",
          "type": "uuid",
          "relation": {
            "relation_kind": "belongs_to",
            "target_entity": "options",
            "target_field": "id"
          }
        }
      ],
      "relationships": [
        {
          "source_field": "poll_id",
          "related_entity": "polls",
          "target_field": "id",
          "kind": "belongs_to"
        },
        {
          "field": "option_id",
          "target_entity": "options",
          "target_field": "id",
          "relation_kind": "belongs_to"
        }
      ]
    }
  ]
}
